{
  "schema_version": "1.0",
  "project_id": "california-1850-tee",
  "product_ref": "product.json",
  "platform": "tiktok_reels",
  "stage": "approved",
  "gen_model": {
    "image": "nano-banana-pro",
    "video": "veo-3"
  },
  "spec": {
    "ratio": "9:16",
    "resolution": "1080x1920",
    "fps": 24,
    "target_sec": 15,
    "safe_zone": {
      "top": 0.15,
      "bottom": 0.2
    }
  },
  "audio": {
    "source": "native",
    "music_duck_db": -12,
    "target_lufs": -14,
    "true_peak_db": -1,
    "export_no_music": true
  },
  "music": {
    "source": "auto",
    "mood": "chill lofi indie surf warm",
    "bpm_range": [
      75,
      95
    ]
  },
  "captions": {
    "enabled": false,
    "style": "none"
  },
  "shots": [
    {
      "id": "s01",
      "role": "hook",
      "file_pattern": "c01*.mp4",
      "gen_sec": 8,
      "use_sec": 3.5,
      "audio_type": "sfx",
      "overlay": "POV: California never leaves you",
      "overlay_pos": "bottom",
      "print_fidelity": "strict"
    },
    {
      "id": "s02",
      "role": "proof",
      "file_pattern": "c02*.mp4",
      "gen_sec": 8,
      "use_sec": 4,
      "audio_type": "sfx",
      "overlay": "Vintage surf graphic",
      "overlay_pos": "top",
      "print_fidelity": "strict",
      "override": {
        "src_in": 3.5
      }
    },
    {
      "id": "s03",
      "role": "lifestyle",
      "file_pattern": "c03*.mp4",
      "gen_sec": 8,
      "use_sec": 4,
      "audio_type": "sfx",
      "overlay": "Wear the Golden State",
      "overlay_pos": "lower"
    },
    {
      "id": "s04",
      "role": "cta",
      "file_pattern": "c04*.mp4",
      "gen_sec": 8,
      "use_sec": 3.5,
      "audio_type": "sfx",
      "overlay": "Get yours — link below ↓",
      "print_fidelity": "strict",
      "override": {
        "src_in": 3.9
      }
    }
  ]
}
